{
  "$schema": "https://json-schema.org/draft/2020-12/schema",
  "$id": "https://ev4.local/contracts/compatibility/runtime-mismatch-prompt-5-routing-compatibility.v1.schema.json",
  "title": "EV4 Runtime Mismatch to Prompt 5 Routing Compatibility v1",
  "x-ev4-contract-id": "runtime-mismatch-prompt-5-routing-compatibility.v1",
  "x-ev4-contract-version": "1.0.0",
  "type": "object",
  "additionalProperties": false,
  "required": [
    "schema_version",
    "compatibility_id",
    "dependencies",
    "shared_lineage",
    "routing_compatibility",
    "authority_boundary",
    "boundary_claims"
  ],
  "properties": {
    "schema_version": {
      "const": "runtime-mismatch-prompt-5-routing-compatibility.v1"
    },
    "compatibility_id": {
      "type": "string",
      "pattern": "^RMR-P5C-[A-Z0-9][A-Z0-9._-]{2,63}$"
    },
    "dependencies": {
      "type": "object",
      "additionalProperties": false,
      "required": [
        "runtime_mismatch_reopen",
        "prompt_5_routing"
      ],
      "properties": {
        "runtime_mismatch_reopen": {
          "$ref": "#/$defs/dependencyPinRuntimeMismatch"
        },
        "prompt_5_routing": {
          "$ref": "#/$defs/dependencyPinPrompt5"
        }
      }
    },
    "shared_lineage": {
      "type": "object",
      "additionalProperties": false,
      "required": [
        "decision_id",
        "decision_schema",
        "repository",
        "commit_sha",
        "artifact_sha256",
        "decision_family",
        "decision_card_ref",
        "selected_option",
        "rejected_options",
        "evidence_refs",
        "evidence_state",
        "consumer_stage",
        "pipeline_id",
        "run_id",
        "producer_export_id",
        "producer_export_schema",
        "producer_export_sha256"
      ],
      "properties": {
        "decision_id": {"type": "string", "minLength": 1},
        "decision_schema": {"type": "string", "minLength": 1},
        "repository": {"type": "string", "pattern": "^[A-Za-z0-9_.-]+/[A-Za-z0-9_.-]+$"},
        "commit_sha": {"type": "string", "pattern": "^[0-9a-f]{40}$"},
        "artifact_sha256": {"type": "string", "pattern": "^[0-9a-f]{64}$"},
        "decision_family": {"type": "string", "minLength": 1},
        "decision_card_ref": {"type": "string", "minLength": 1},
        "selected_option": {"const": "blocked_pending_input"},
        "rejected_options": {
          "type": "array",
          "minItems": 1,
          "uniqueItems": true,
          "items": {"type": "string", "minLength": 1}
        },
        "evidence_refs": {
          "type": "array",
          "minItems": 1,
          "uniqueItems": true,
          "items": {"type": "string", "minLength": 1}
        },
        "evidence_state": {"const": "reopen_required"},
        "consumer_stage": {"const": "runtime_evidence_conflict"},
        "pipeline_id": {"type": "string", "minLength": 1},
        "run_id": {"type": "string", "minLength": 1},
        "producer_export_id": {"type": "string", "minLength": 1},
        "producer_export_schema": {"const": "producer-gate-export.v1"},
        "producer_export_sha256": {"type": "string", "pattern": "^[0-9a-f]{64}$"}
      }
    },
    "routing_compatibility": {
      "type": "object",
      "additionalProperties": false,
      "required": [
        "reopen_requested_action",
        "prompt_5_target",
        "prompt_5_decision",
        "transport_eligible",
        "diagnostic_codes"
      ],
      "properties": {
        "reopen_requested_action": {
          "const": "reopen_for_authoritative_review"
        },
        "prompt_5_target": {
          "const": "ev4-project-gate"
        },
        "prompt_5_decision": {
          "const": "route"
        },
        "transport_eligible": {
          "const": true
        },
        "diagnostic_codes": {
          "type": "array",
          "maxItems": 0
        }
      }
    },
    "authority_boundary": {
      "type": "object",
      "additionalProperties": false,
      "required": [
        "kernel_decision_owner",
        "routing_decision_owner",
        "transport_execution_owner",
        "responsive_may_observe",
        "responsive_may_replace_decision",
        "responsive_executes_transport",
        "responsive_substitutes_project_gate_decision",
        "authoritative_redecision_required"
      ],
      "properties": {
        "kernel_decision_owner": {"const": "ev4-decision-kernel"},
        "routing_decision_owner": {"const": "responsive"},
        "transport_execution_owner": {"const": "ev4-project-gate"},
        "responsive_may_observe": {"const": true},
        "responsive_may_replace_decision": {"const": false},
        "responsive_executes_transport": {"const": false},
        "responsive_substitutes_project_gate_decision": {"const": false},
        "authoritative_redecision_required": {"const": true}
      }
    },
    "boundary_claims": {
      "$ref": "#/$defs/boundaryClaims"
    }
  },
  "$defs": {
    "dependencyPinRuntimeMismatch": {
      "type": "object",
      "additionalProperties": false,
      "required": ["contract_id", "schema_version", "source_repository", "source_commit_sha", "schema_path", "schema_git_blob_sha", "schema_sha256"],
      "properties": {
        "contract_id": {"const": "runtime-mismatch-reopen-package.v1"},
        "schema_version": {"const": "runtime-mismatch-reopen-package.v1"},
        "source_repository": {"const": "rezahh107/EV4-Responsive-Architect"},
        "source_commit_sha": {"const": "993e770229e0b88b7bd3c5068f6f5d59e1392743"},
        "schema_path": {"const": "contracts/runtime/runtime-mismatch-reopen-package.v1.schema.json"},
        "schema_git_blob_sha": {"const": "7b868ffbe6f79c70e20831a45a0032a19cc07002"},
        "schema_sha256": {"const": "1f8cb3db9cb9330ed72aabdfb065866fce2cf1a0eb961edf7c7ce5d18cad1445"}
      }
    },
    "dependencyPinPrompt5": {
      "type": "object",
      "additionalProperties": false,
      "required": ["contract_id", "schema_version", "source_repository", "source_commit_sha", "schema_path", "schema_git_blob_sha", "schema_sha256"],
      "properties": {
        "contract_id": {"const": "prompt-5-routing-envelope.v1"},
        "schema_version": {"const": "prompt-5-routing-envelope.v1"},
        "source_repository": {"const": "rezahh107/EV4-Responsive-Architect"},
        "source_commit_sha": {"const": "993e770229e0b88b7bd3c5068f6f5d59e1392743"},
        "schema_path": {"const": "contracts/project-gate/prompt-5-routing-envelope.v1.schema.json"},
        "schema_git_blob_sha": {"const": "9557994fcdb8f78b38ad2fff191b0b7a1e512746"},
        "schema_sha256": {"const": "172e7585af7cec08ed722f7ea88a10e138d2740239789ae6f4499251d686e3a8"}
      }
    },
    "boundaryClaims": {
      "type": "object",
      "additionalProperties": false,
      "required": [
        "submitted_evidence_created",
        "issue_8_mutated",
        "pilot_authorized",
        "production_ready",
        "release_ready",
        "live_render_validated",
        "export_json_validated",
        "accessibility_passed",
        "pixel_perfect",
        "responsive_correctness_validated"
      ],
      "properties": {
        "submitted_evidence_created": {"const": false},
        "issue_8_mutated": {"const": false},
        "pilot_authorized": {"const": false},
        "production_ready": {"const": false},
        "release_ready": {"const": false},
        "live_render_validated": {"const": false},
        "export_json_validated": {"const": false},
        "accessibility_passed": {"const": false},
        "pixel_perfect": {"const": false},
        "responsive_correctness_validated": {"const": false}
      }
    }
  }
}
