{
  "schema_version": "runtime-mismatch-prompt-5-routing-compatibility.v1",
  "compatibility_id": "RMR-P5C-VALID-001",
  "dependencies": {
    "runtime_mismatch_reopen": {
      "contract_id": "runtime-mismatch-reopen-package.v1",
      "schema_version": "runtime-mismatch-reopen-package.v1",
      "source_repository": "rezahh107/EV4-Responsive-Architect",
      "source_commit_sha": "993e770229e0b88b7bd3c5068f6f5d59e1392743",
      "schema_path": "contracts/runtime/runtime-mismatch-reopen-package.v1.schema.json",
      "schema_git_blob_sha": "7b868ffbe6f79c70e20831a45a0032a19cc07002",
      "schema_sha256": "1f8cb3db9cb9330ed72aabdfb065866fce2cf1a0eb961edf7c7ce5d18cad1445"
    },
    "prompt_5_routing": {
      "contract_id": "prompt-5-routing-envelope.v1",
      "schema_version": "prompt-5-routing-envelope.v1",
      "source_repository": "rezahh107/EV4-Responsive-Architect",
      "source_commit_sha": "993e770229e0b88b7bd3c5068f6f5d59e1392743",
      "schema_path": "contracts/project-gate/prompt-5-routing-envelope.v1.schema.json",
      "schema_git_blob_sha": "9557994fcdb8f78b38ad2fff191b0b7a1e512746",
      "schema_sha256": "172e7585af7cec08ed722f7ea88a10e138d2740239789ae6f4499251d686e3a8"
    }
  },
  "shared_lineage": {
    "decision_id": "DEC-001",
    "decision_schema": "decision-card.v1",
    "repository": "rezahh107/EV4-Decision-Kernel",
    "commit_sha": "1111111111111111111111111111111111111111",
    "artifact_sha256": "aaaaaaaaaaaaaaaaaaaaaaaaaaaaaaaaaaaaaaaaaaaaaaaaaaaaaaaaaaaaaaaa",
    "decision_family": "responsive-runtime",
    "decision_card_ref": "decision-cards/DEC-001.json",
    "selected_option": "blocked_pending_input",
    "rejected_options": ["continue_without_review"],
    "evidence_refs": ["evidence/runtime-observation-001.json"],
    "evidence_state": "reopen_required",
    "consumer_stage": "runtime_evidence_conflict",
    "pipeline_id": "PIPE-001",
    "run_id": "RUN-001",
    "producer_export_id": "EXP-001",
    "producer_export_schema": "producer-gate-export.v1",
    "producer_export_sha256": "bbbbbbbbbbbbbbbbbbbbbbbbbbbbbbbbbbbbbbbbbbbbbbbbbbbbbbbbbbbbbbbb"
  },
  "routing_compatibility": {
    "reopen_requested_action": "reopen_for_authoritative_review",
    "prompt_5_target": "ev4-project-gate",
    "prompt_5_decision": "route",
    "transport_eligible": true,
    "diagnostic_codes": []
  },
  "authority_boundary": {
    "kernel_decision_owner": "ev4-decision-kernel",
    "routing_decision_owner": "responsive",
    "transport_execution_owner": "ev4-project-gate",
    "responsive_may_observe": true,
    "responsive_may_replace_decision": false,
    "responsive_executes_transport": false,
    "responsive_substitutes_project_gate_decision": false,
    "authoritative_redecision_required": true
  },
  "boundary_claims": {
    "submitted_evidence_created": false,
    "issue_8_mutated": false,
    "pilot_authorized": false,
    "production_ready": false,
    "release_ready": false,
    "live_render_validated": false,
    "export_json_validated": false,
    "accessibility_passed": false,
    "pixel_perfect": false,
    "responsive_correctness_validated": false
  }
}
